CLINICAL GASTROINTESTINAL ENDOSCOPY 2e (hb) 2018,"The second edition of this very popular atlas is designed to serve as an up-to-date guide to the diagnostic use of gastrointestinal endoscopy that will meet the daily needs of both novice and advanced endoscopists. The atlas presents an abundance of typical and atypical endoscopic images of common and rare diseases of the esophagus, stomach, small intestine, and colorectum, accompanied by precise clinical descriptions. Normal findings and variants are also amply documented. A large majority of the illustrations in the new edition are superb high-resolution images, reflecting the important advances of recent years. The coverage also includes the role of novel endoscopic technologies such as narrow band imaging, FICE, iScan, and confocal laser endomicroscopy. A further new feature is the inclusion of an interesting quiz at the end of each chapter in order to summarize complex knowledge, enhance understanding, and assist in the internalization of important practical tips. Clinical Gastrointestinal Endoscopy: A Comprehensive Atlas is expected to become the ultimate reference for gastrointestinal endoscopists worldwide.  Authors: Hoon Jai Chun is Professor and Chief of the Division of Gastroenterology and Hepatology, Department of Internal Medicine, Korea University College of Medicine, Seoul, Korea. Dr. Chun has established various methods of endoscopic treatment for gastrointestinal diseases and holds numerous patents related to endoscopic diagnostic and therapeutic devices. Furthermore, he has undertaken research studies on prevention and treatment of functional gastrointestinal disease, Helicobacter pylori infection and gastrointestinal cancer. Dr. Chun has served as Secretary General of the Korean Society of Gastrointestinal Endoscopy and Secretary General of the Korean Society of Gastrointestinal Cancer. Dr. Chun is also a member of many international gastroenterology societies, including the European Society of Gastrointestinal Endoscopy (ESGE) and Japan Gastroenterological Endoscopy Society (JGES), and is a Fellow of both the American Gastroenterological Association (AGAF) and the American Soc  iety of Gastrointestinal Endoscopy (FASGE). He has published more than 400 full scientific articles in the foremost journals and written numerous book chapters. Dr. Chun has also been an editor and a reviewer of more than 15 prestigious international journals. His contributions to the medical sciences and academic advancement have been recognized with many domestic and international academic awards. Myung-Gyu Choi graduated from the College of Medicine, the Catholic University of Korea, in 1982 and completed his internship and residency in Internal Medicine at St. Mary’s Hospital of the Catholic University of Korea. After obtaining his PhDfrom the same graduate schoolin 1993, he served as a visiting scientist at the Mayo Clinic, USA from 1995 to 1997. He is currently Director of the Gastroenterology Center of Seoul St. Mary's Hospital and Professor in the Department of Internal Medicine at The Catholic University of Korea. Dr. Choi is a pre-eminent leader in gastroenterology, with a particular interest in clinical endoscopy and enteric neuroscience. He is current President of the Korean Society of Gastrointestinal Endoscopy and was President of the Korean Society of Neurogastroenterology and Motility from 2007 to 2009. Dr. Choi has served as leader of the Korean Gut Image Study Group during the past decade, which has overseen the National Capsule Endoscopy Registry. He has also made important contributions in developing diagnostic and treatment guidelines for gastrointestinal diseases in Korea. He has published over 200 original articles in national and international journals.  Suk-KyunYang is Professor of Gastroenterology at University of Ulsan College of Medicine and Director of the Inflammatory Bowel Disease Center at Asan Medical Center, Seoul, Korea. Dr. Yang earned his MD at Seoul National University College of Medicine and completed his residency in Internal Medicine at Seoul National University Hospital and his fellowship in Gastroenterolo  gy at Asan Medical Center. He obtained his postdoctoral research fellowship at the Mucosal Immunology Laboratory of University of California, San Diego.Dr.Yang is an active member of the Korean Association for the Study of Intestinal Diseases (KASID) and serves as president of the KASID.He has also served as a board member of many national societies, including the Korean Society of Gastrointestinal Endoscopy and the Korean Society of Gastroenterology.Dr. Yang has published over 200 original articles and has written numerous book chapters. He has also written two colonoscopic atlases: Colonoscopic Diagnosis (Koonja Publishing, 1999) and Colonoscopy:Diagnosis and Treatment (Koonja Publishing, 2009). His research interests include the epidemiology,genetics, and endoscopic diagnosis of inflammatory bowel disease.","PKR 24,149.00",HOON JAI CHUN,9789811049941,2019,MEDICAL > GASTROENTEROLOGY,2,Hard Cover,English,752,images/books/9789811049941.jpg,http://paramountbooks.com.pk/loginindex.asp?title=CLINICAL%2DGASTROINTESTINAL%2DENDOSCOPY%2D2e%2D%28hb%29%2D2018&isbn=9789811049941&opt=3&SubCat=06&Cat=06010
GASTROINTESTINAL COMPLICATIONS OF DIABETES (hb) 2018,"Provides a comprehensive, state-of-the art review of the gastrointestinal complications of diabetes Each chapter features diagnostic and treatment algorithms that serve as useful guidelines and reference point for everyday practice Written by experts in the field   This text provides a state-of-the art review of the gastrointestinal complications of diabetes, their pathophysiology, clinical manifestations, diagnostic evaluation and management. Divided into six sections, the volume shows how diabetes affects the entire GI tract, from the oral cavity and esophagus to the large bowel and anorectal region. By offering a detailed diagnostic approach and featuring therapeutic algorithms at the end of each chapter, the text is a useful guideline and reference point for every day practice, specifically in recognizing and diagnosing patients with gastrointestinal complications of diabetes in a timely fashion.  Written by experts in the field, Gastrointestinal Complications of Diabetes: A Comprehensive Guide is a valuable resource for physicians dealing with diabetes mellitus or gastrointestinal disorders, and researchers interested in this multidisciplinary problem.    Author: Marko Duvnjak, MD, PhDUniversity of Zagreb School of MedicineSestre milosrdnice University Hospital CenterDepartment of Internal MedicineDivision of Gastroenterology and HepatologyZagrebCroatia Lea Smircic-Duvnjak, MD, PhDUniversity of Zagreb School of Medicine Merkur University HospitalVuk Vrhovac University Clinic for Diabetes, Endocrinology and Metabolic DiseasesZagrebCroatia ","PKR 20,433.00",MARKO DUVNJAK,9783319758558,2018,MEDICAL > GASTROENTEROLOGY,1,Hard Cover,English,349,images/books/9783319758558.jpg,http://paramountbooks.com.pk/loginindex.asp?title=GASTROINTESTINAL%2DCOMPLICATIONS%2DOF%2DDIABETES%2D%28hb%29%2D2018&isbn=9783319758558&opt=3&SubCat=06&Cat=06010
GASTROENTEROLOGICAL ENDOSCOPY 3e (hb) 2018 (PLUS VIDEOS) INTERNATIONAL EDITION,,"PKR 8,995.00",WALLACE,9789388257275,2018,MEDICAL > GASTROENTEROLOGY,3,Hard Cover,English,,images/books/9789388257275.jpg,http://paramountbooks.com.pk/loginindex.asp?title=GASTROENTEROLOGICAL%2DENDOSCOPY%2D3e%2D%28hb%29%2D2018%2D%28PLUS%2DVIDEOS%29%2DINTERNATIONAL%2DEDITION&isbn=9789388257275&opt=3&SubCat=06&Cat=06010
THERAPEUTIC ENDOSCOPY IN THE GASTROINTESTINAL TRACT(hb) 2018,"Describes all established and new procedures in endoscopic therapy  Richly illustrated throughout  A “hands-on” guide that offers detailed instructions on how to perform endoscopic therapy  A treasure trove for every physician or surgeon who performs endoscopies  This book, written by experts on gastroenterology and digestive surgery, provides comprehensive and detailed descriptions of all established and newly developed interventional endoscopic procedures. For each procedure, it addresses: indications; staff, instrumental and technical requirements; and results, potential complications and their management. Also featuring a wealth of images and drawings of the procedures, as well as helpful hints and tips, the book offers a valuable resource for young and seasoned internists and surgeons alike, as well as endoscopy specialists in other fields.  Author: Prof. Georg Kähler is Director of the Interdisciplinary Endoscopy Unit (ZIE), Medical Center Mannheim, University of Heidelberg. Prof. Martin Götz is Director of the Interdisciplinary Endoscopy, University Hospital, Tübingen. Prof. Norbert Senninger is Director of the Clinic for General and Abdominal Surgery, University Hospital Münster. ","PKR 16,718.00",GEORG KAHLER,9783319554679,2018,MEDICAL > GASTROENTEROLOGY,1,Hard Cover,English,249,images/books/9783319554679.jpg,http://paramountbooks.com.pk/loginindex.asp?title=THERAPEUTIC%2DENDOSCOPY%2DIN%2DTHE%2DGASTROINTESTINAL%2DTRACT%28hb%29%2D2018&isbn=9783319554679&opt=3&SubCat=06&Cat=06010
GASTROENTEROLOGICAL ENDOSCOPY 3e (hb) 2018 (PLUS VIDEOS) INTERNATIONAL EDITION,,"PKR 8,995.00",WALLACE,9789388257008,2018,MEDICAL > GASTROENTEROLOGY,3,Hard Cover,English,,,http://paramountbooks.com.pk/loginindex.asp?title=GASTROENTEROLOGICAL%2DENDOSCOPY%2D3e%2D%28hb%29%2D2018%2D%28PLUS%2DVIDEOS%29%2DINTERNATIONAL%2DEDITION&isbn=9789388257008&opt=3&SubCat=06&Cat=06010
MINIATLAS GASTROENTEROLOGY - ILLUSTRATIONS (pb) 2018,,PKR 695.00,. . .,9999036,2018,MEDICAL > GASTROENTEROLOGY,,Paperback,English,,,http://paramountbooks.com.pk/loginindex.asp?title=MINIATLAS%2DGASTROENTEROLOGY%2D%2D%2DILLUSTRATIONS%2D%28pb%29%2D2018&isbn=9999036&opt=3&SubCat=06&Cat=06010
MINIATLAS DISORDERS OF THE EXOCRINE PANCREAS (pb) 2018,,PKR 695.00,. . .,9999039,2018,MEDICAL > GASTROENTEROLOGY,1,Paperback,English,,,http://paramountbooks.com.pk/loginindex.asp?title=MINIATLAS%2DDISORDERS%2DOF%2DTHE%2DEXOCRINE%2DPANCREAS%2D%28pb%29%2D2018&isbn=9999039&opt=3&SubCat=06&Cat=06010
MINIATLAS GASTROENTEROLOGY (pb) 2018,,PKR 795.00,. . .,9999035,2018,MEDICAL > GASTROENTEROLOGY,,Paperback,English,,,http://paramountbooks.com.pk/loginindex.asp?title=MINIATLAS%2DGASTROENTEROLOGY%2D%28pb%29%2D2018&isbn=9999035&opt=3&SubCat=06&Cat=06010
CLINICS IN GASTROENTEROLOGY (pb) 2018,,"PKR 1,142.00",K. ALAKA,9789386478139,2018,MEDICAL > GASTROENTEROLOGY,,Paperback,English,148,images/books/9789386478139.jpg,http://paramountbooks.com.pk/loginindex.asp?title=CLINICS%2DIN%2DGASTROENTEROLOGY%2D%28pb%29%2D2018&isbn=9789386478139&opt=3&SubCat=06&Cat=06010
UPPER ENDOSCOPY FOR FI GELOWS (hb) 2017,"Provides a concise overview of the most common aspects of upper endoscopy Includes online video clips that illustrate major concepts in the text Written by experts in the field  This volume provides a concise overview of the most important and vital aspects of upper endoscopy. The text is specifically geared towards first-year GI fellows and novice endoscopists in order to help them rapidly assimilate the core concepts needed to perform upper endoscopy in the most important and most commonly encountered clinical situations. The book also covers the most important variations of normal anatomy and pathology and how to manage them. Key concepts covered include foreign body removal, diagnosis and management of upper GI bleeding, Barrett's Esophagus, evaluation and management of benign and malignant strictures of the esophagus, stomach, and duodenum, submucosal lesions, and evaluation of post operative upper GI anatomy. A plethora of high quality color illustrations and narrated online video clips illustrate major concepts in the book are also included. Written by experts in the field, Upper Endoscopy for GI Fellows is a valuable resource for new physicians just starting to perform upper endoscopy.   Author: Douglas G. Adler  Douglas G. Adler, MD, FACG, AGAF, FASGE received his medical degree from Cornell University Medical College in New York, NY. He completed his residency in internal medicine at Beth Israel Deaconess Medical Center/Harvard Medical School, in Boston, MA. Dr. Adler completed both a general gastrointestinal fellowship and a therapeutic endoscopy/ERCP fellowship at Mayo Clinic in Rochester, MN. He then returned to the Beth Israel Deaconess Medical Center for a fellowship in endoscopic ultrasound. Dr. Adler is currently a tenured Professor of Medicine and Director of Therapeutic Endoscopy at the University Of Utah School Of Medicine in Salt Lake City, UT. Dr. Adler is also the GI Fellowship Program Director at the University Of Utah School Of Medicine. Working primarily at the University Of Utah School Of Medicine’s Huntsman Cancer Institute, Dr. Adler focuses his clinical, educational, and research efforts on the diagnosis and management of patients with gastrointestinal cancers and complex gastrointestinal disease, with an emphasis on therapeutic endoscopy. He is the author of more than 250 scientific publications, articles, and book chapters. This is Dr. Adler’s sixth textbook on gastroenterology.","PKR 16,718.00",DAVID A. ADLER,9783319490397,2017,MEDICAL > GASTROENTEROLOGY,1,Hard Cover,English,182,images/books/9783319490397.jpg,http://paramountbooks.com.pk/loginindex.asp?title=UPPER%2DENDOSCOPY%2DFOR%2DFI%2DGELOWS%2D%28hb%29%2D2017&isbn=9783319490397&opt=3&SubCat=06&Cat=06010
"BEDSIDE TECHNIQUES: METHODS OF CLINICAL EXAMAMINATION, 5e (pb) 2019",,PKR 595.00,MUHAMMAD INAYATULLAH,9789696375258,2019,MEDICAL > GENERAL PRACTICE,5,Paperback,English,232,images/books/9789696375258.jpg,http://paramountbooks.com.pk/loginindex.asp?title=BEDSIDE%2DTECHNIQUES%3A%2DMETHODS%2DOF%2DCLINICAL%2DEXAMAMINATION%2C%2D5e%2D%28pb%29%2D2019&isbn=9789696375258&opt=3&SubCat=06&Cat=06011
"MURTAGH'S GENERAL PRACTICE, 7e(hb)2018","Author:  J. Murtagh, Dr Jill Rosenblatt MBBS FRACGP DipObstRCOG GradDipAppSci, Dr Clare Murtagh MBBS FRACGP, Dr Justin Coleman MBBS FRACGP MPH ","PKR 19,942.00",MURTAGH,9781760422295,2018,MEDICAL > GENERAL PRACTICE,7,Hard Cover,English,1600,images/books/9781760422295.jpg,http://paramountbooks.com.pk/loginindex.asp?title=MURTAGH%27S%2DGENERAL%2DPRACTICE%2C%2D7e%28hb%292018&isbn=9781760422295&opt=3&SubCat=06&Cat=06011
UNUSUAL DISEASES WITH COMMON SYMPTOMS: A CLINICAL CASEBOOK (hb) 2018,"Detailed case reports of uncommon diseases that present with common symptoms  Covers a wide range of diseases that affect multi-organ systems Includes historical context, reviews early and later literature, and makes recommendations for clinical care  This book presents detailed case reports of unusual diseases with common symptoms, many of which have emerged in the past decade as a result of nature, advances in medical treatment, and increasing recognition of specific underpinnings of human biology and immunology. These rare diseases must now be considered when the mundane diagnoses do not exactly fit the patient’s clinical history or treatment fails. Some of these diseases include: eosinophilic esophagitis, blastocystis hominis infection, and paromyces allergic fungal sinusitis. Chapters provide in depth clinical examples of a wide range of diseases affecting multiple organ systems. Each case is structured by: a vignette of the case, background / salient features of the case, diagnosis, treatment, key points, and questions to aid in critical thinking. Unusual Diseases with Common Symptoms: A Clinical Casebook is of great interest to practicing physicians and as a teaching resource for students and residents who will one day encounter conditions more complex than they initially appear.  Author: Anthony M. Szema  Anthony M. Szema, MD, FCCP. FACAAI, FAAAAI, FACP Hofstra Northwell School of Medicine at Hofstra University, Hempstead, NY  Columbia University Child and Adolescent Psychiatric Epidemiology Group, NY, NY  Stony Brook University Department of Technology and Society. College of Engineering and Applied Sciences, Stony Brook. NY Three Village Allergy and Asthma, PLLC, South Setauket, NY","PKR 16,718.00",ANTHONY M. SZEMA,9783319589510,2018,MEDICAL > GENERAL PRACTICE,1,Hard Cover,English,238,images/books/9783319589510.jpg,http://paramountbooks.com.pk/loginindex.asp?title=UNUSUAL%2DDISEASES%2DWITH%2DCOMMON%2DSYMPTOMS%3A%2DA%2DCLINICAL%2DCASEBOOK%2D%28hb%29%2D2018&isbn=9783319589510&opt=3&SubCat=06&Cat=06011
CLINICAL MANAGEMENT OF HEART FAILURE 3e (pb) 2017,"In this new 3rd edition, the authors have made every effort to keep the text concise. They have attempted to base as much of the discussion of heart failure management on pathophysiologic principles as possible. They have provided references, whenever possible, to review articles and sound meta-analyses rather than primary data so that readers have access to the overall weight of evidence on a question. Technical abbreviations are listed with definitions in Chapter 12. The format the authors have employed emphasizes the graphic display of information: Kaplan-Meir plots of mortality and re-hospitalization data. Forrest plots to show subgroup analyses, and tables to summarize lists. For any given patient, prognosis may vary widely based on demographics and comorbidities; they have emphasized the importance of careful, complete evaluation and management. In addition, clinicians should exercise the option for consultation with an experienced heart transplant/mechanical cardiac support device center early in the heart failure management process. The authors hope this volume will be a useful adjunct to health care professionals in practice, particularly those in the early stages of their careers. Their intent is for it to be handy, to be available, and to be easy to use.  About the Author Javed Butler, MD, MPH, Professor of Medicine, Director, Division of Cardiovascular Medicine, Co-Director, Heart Institute, Stony Brook University School of Medicine. Roger M. Mills, MD, FACP, FACC, Cardiologist, Dexter, MI. James B. Young, MD is Professor Medicine and Executive Dean, Cleveland Clinic Lerner College of Medicine fo Case Western University.","PKR 5,713.00",JAVED BUTLER,9781932610369,2018,MEDICAL > GENERAL PRACTICE,3,Paperback,English,336,images/books/9781932610369.jpg,http://paramountbooks.com.pk/loginindex.asp?title=CLINICAL%2DMANAGEMENT%2DOF%2DHEART%2DFAILURE%2D3e%2D%28pb%29%2D2017&isbn=9781932610369&opt=3&SubCat=06&Cat=06011
TREATMENT GUIDE 13e(pb)2018,"This book aims to help the practicing physician, in both the hospital and general practice environment by providing a core of sample prescriptions that can be used as such in treatments and as the physician gets more experience, he can adapt or even change these to suit his local requirements.   Trade names are more familiar and are used in prescriptions so these have been used in the samples; only one trade name of a generic substance is used to avoid confusion, this does not mean any endorsement of a particular brand over another; but the physician is cautioned against the veritable explosion of dubious pharmaceuticals and preparations and advises to choose good quality preparations.  Author: Dr. Muhammad Inayatullah is a graduate, and now, a professor of Medicine at Nishtar Medical College, Multan. He is also a Fellow of Royal College of Physicians, London. This talented author has penned two other books:   Essentials of Differential Diagnosis Bedside Techniques: Methods of Clinical Examination ",PKR 645.00,MUHAMMAD INAYATULLAH,9789696373971,2018,MEDICAL > GENERAL PRACTICE,13,Paperback,English,784,images/books/9789696373971.jpg,http://paramountbooks.com.pk/loginindex.asp?title=TREATMENT%2DGUIDE%2D13e%28pb%292018&isbn=9789696373971&opt=3&SubCat=06&Cat=06011
CHRONIC ILLNESS CARE (hb) 2018,"Offers practicing physicians and health care professionals a general guide on caring for patients with chronic illness Uses an ecological perspective to examine multiple levels that impact chronic illness care, from administrative concerns to a patient’s family Includes guidelines on how to work within a team of care professionals to maximize patient care  This book offers a comprehensive overview to chronic illness care, which is the coordinated, comprehensive, and sustained response to chronic diseases and conditions by a range of health care providers, formal and informal caregivers, healthcare systems, and community-based resources. Using an ecological framework, which looks at the interdependent influences between individuals and their larger environment, this unique text examines chronic illness care at multiple levels and includes  sections on the individual influences on chronic illness, the role of family and social networks, and how chronic care is provided across the spectrum of health care settings; from home to clinic to the emergency department to hospital and residential care facilities.  The book describes the organizational frameworks and strategies that are needed to provide quality care for chronically ill patients, including behavioral health, care management, transitions of care, and health information technology. The book also addresses the changing workforce needs in health care, and the fiscal models and policies that will be required to meet the needs of this population, with a focus on sustaining the ongoing transformation in health care.  This book acts as a major reference for practitioners and students in medicine, nursing, social work, allied health, and behavioral medicine, as well as stakeholders in public health, health policy, and population health.   Author: Timothy P. Daaleman, DO, MPH, Professor, Department of Family Medicine, University of North Carolina, Chapel Hill, NC, USA  Margaret R. Helton, MD, Professor, Department of Family Medicine, University of North Carolina, Chapel Hill, NC, USA ","PKR 20,433.00",TIMOTHY P. DAALEMAN,9783319718118,2018,MEDICAL > GENERAL PRACTICE,1,Hard Cover,English,575,images/books/9783319718118.jpg,http://paramountbooks.com.pk/loginindex.asp?title=CHRONIC%2DILLNESS%2DCARE%2D%28hb%29%2D2018&isbn=9783319718118&opt=3&SubCat=06&Cat=06011
"CURRENT PRACTICE GUIDELINES IN PRIMARY CARE 2017, 15e (pb) 2017","Today’s Best Practices in Your Pocket! Guidelines for the most common outpatient conditions – in a NEW user-friendly outline format! A  Doody's Core Title for 2017! CURRENT Practice Guidelines in Primary Care 2017 has been reformatted into an easy-to-use outline to provide you with quick access to screening, prevention, and treatment guidelines for the common outpatient conditions. Content is drawn from a wide array of recommendations from government agencies, expert panels, medical specialty organizations, and other professional and scientific organizations.  Each topic is carefully selected for relevance to the office practice of ambulatory medicine, and the text overflows with clinical pearls, easy-to-apply take home points, and guideline-based algorithms designed to simplify clinical decision-making. • Every topic updated  • NEW user-friendly outline format speeds you to most current screening, prevention, and management guidelines • The perfect balance between brevity and clinical necessity – exactly the amount of information you need – no more, less • Authoritative content drawn from government agencies, medical and scientific organizations, and expert panels • Carefully selected for relevance to the office practice of ambulatory medicine • Easy-to-apply take-home points are perfect for busy clinicians • Clinical pearls for all healthcare providers • Spans all areas of general medicine • Website addresses for U.S. government agencies and professional societies • Updated evidence-based content  Author:  Joseph S. Esherick, MD (Ventura, CA) is Medical Director of Critical Care Services and Associate Director of Medicine at Ventura County Medical Center, and Associate Clinical Professor of Family Medicine at David Geffen School of Medicine.  Evan D. Slater, MD (Ventura, CA) is Director of Hematology and Medical Oncology at Ventura County Hospital, and Assistant Clinical Professor of Family Medicine at David Geffen School of Medicine.  Jacob A. David, MD (Ventura, CA) is Associate Program Director at Ventura Country Medical Center.  ","PKR 3,106.00",JOSEPH S. ESHERICK,9781259921605,2017,MEDICAL > GENERAL PRACTICE,15,Paperback,English,608,images/books/9781259921605.jpg,http://paramountbooks.com.pk/loginindex.asp?title=CURRENT%2DPRACTICE%2DGUIDELINES%2DIN%2DPRIMARY%2DCARE%2D2017%2C%2D15e%2D%28pb%29%2D2017&isbn=9781259921605&opt=3&SubCat=06&Cat=06011
