ACUPRESSURE AND REFLEXOLOGY FOR DUMMIES (pb),"Searching for alternative treatments for pain? This friendly, do-it-yourself guide introduces you to the basics and benefits of acupressure and reflexology, showing you step by step how to nurture your emotional and physical well-being and that of someone else. You'll see how to target specific body parts to address your ailments and improve your emotional as well as your physical well-being. Understand basic healing principles  Relieve your specific aches and pains  Boost your immune system  Address age-related ailments  Find professional help  About the Author Synthia Andrews has been a message and bodywork therapist for 25 years. She is an authorized teacher of Jin Shin Do Bodymind Acupressure, has been on faculty at the Connecticut Center for Massage Therapy for 16 years, and was a four-year faculty member at the Kripalu Yoga Institute. She is licensed in the state of Connecticut, where she maintains a private practice, and is currently a forth-year student of Naturopathic Medicine at the University of Bridgeport. Her Real love is using acupressure to help abused, neglected. ",PKR 690.00,SYNTHIA ANDREWS,9788126514359,2010,MEDICAL > ACUPUNCTURE,1,Paperback,English,,images/books/9788126514359.jpg,http://paramountbooks.com.pk/loginindex.asp?title=ACUPRESSURE%2DAND%2DREFLEXOLOGY%2DFOR%2DDUMMIES%2D%28pb%29&isbn=9788126514359&opt=3&SubCat=06&Cat=06001
PATIENT-PRACTITIONER RELATIONSHSIP IN ACUPUNCTURE(pb)2009,The Patient-Practitioner Relationship in Acupuncture,"PKR 4,742.00",LEON I. HAMMER,9783131488411,2009,MEDICAL > ACUPUNCTURE,1,Paperback,English,126,images/books/9783131488411.jpg,http://paramountbooks.com.pk/loginindex.asp?title=PATIENT%2DPRACTITIONER%2DRELATIONSHSIP%2DIN%2DACUPUNCTURE%28pb%292009&isbn=9783131488411&opt=3&SubCat=06&Cat=06001
ADVANCED ACUPUNCTURE THERAPY (pb)2009,,"PKR 1,834.00",AGRAWAL,9788123917269,2009,MEDICAL > ACUPUNCTURE,1,Paperback,English,500,images/books/9788123917269.jpg,http://paramountbooks.com.pk/loginindex.asp?title=ADVANCED%2DACUPUNCTURE%2DTHERAPY%2D%28pb%292009&isbn=9788123917269&opt=3&SubCat=06&Cat=06001
CLINICAL ACUPUNCTURE (hb)2007,,"PKR 1,036.00",A JAYASURIYA,9788131902677,2007,MEDICAL > ACUPUNCTURE,1,Hard Cover,English,1046,images/books/9788131902677.jpg,http://paramountbooks.com.pk/loginindex.asp?title=CLINICAL%2DACUPUNCTURE%2D%28hb%292007&isbn=9788131902677&opt=3&SubCat=06&Cat=06001
ACUPUNCTURE AND ACUPRESSURE GUIDE (pb)2005,,PKR 219.00,DR. GOEL SATISH,8171820255,2005,MEDICAL > ACUPUNCTURE,1,Paperback,English,218,images/books/8171820255.jpg,http://paramountbooks.com.pk/loginindex.asp?title=ACUPUNCTURE%2DAND%2DACUPRESSURE%2DGUIDE%2D%28pb%292005&isbn=8171820255&opt=3&SubCat=06&Cat=06001
ACUPUNCTURE CURE FOR COMMON DISEASES (pb)2004,,PKR 173.00,RAMAN KAPUR,8122202322,2004,MEDICAL > ACUPUNCTURE,1,Paperback,English,191,images/books/8122202322.jpg,http://paramountbooks.com.pk/loginindex.asp?title=ACUPUNCTURE%2DCURE%2DFOR%2DCOMMON%2DDISEASES%2D%28pb%292004&isbn=8122202322&opt=3&SubCat=06&Cat=06001
ACUPRESSURE CURE FOR COMMON DISEASES (pb)2004,,PKR 185.00,DR K. KENYON,8122200087,2004,MEDICAL > ACUPUNCTURE,1,Paperback,English,144,images/books/8122200087.jpg,http://paramountbooks.com.pk/loginindex.asp?title=ACUPRESSURE%2DCURE%2DFOR%2DCOMMON%2DDISEASES%2D%28pb%292004&isbn=8122200087&opt=3&SubCat=06&Cat=06001
ALL ABOUT: ACUPRESSURE HEALING ENERGY IN YOUR HANDS (pb)2004,,PKR 173.00,P.PURUSHOTHAMA RAJ RAJ,8172453671,2004,MEDICAL > ACUPUNCTURE,1,Paperback,English,142,images/books/8172453671.jpg,http://paramountbooks.com.pk/loginindex.asp?title=ALL%2DABOUT%3A%2DACUPRESSURE%2DHEALING%2DENERGY%2DIN%2DYOUR%2DHANDS%2D%28pb%292004&isbn=8172453671&opt=3&SubCat=06&Cat=06001
THE COMPLETE IDIOT'S GUIDE: TO ACUPUNCTURE AND ACUPRESSURE (pb) 2000,,PKR 295.00,SOLLARS,28639421,2000,MEDICAL > ACUPUNCTURE,1,Paperback,English,293,images/books/0028639421.jpg,http://paramountbooks.com.pk/loginindex.asp?title=THE%2DCOMPLETE%2DIDIOT%27S%2DGUIDE%3A%2DTO%2DACUPUNCTURE%2DAND%2DACUPRESSURE%2D%28pb%29%2D2000&isbn=0028639421&opt=3&SubCat=06&Cat=06001
ATLAS OF THYROID AND NEUROENDOCRINE TUMOR MARKERS (hb) 2018,"Presents updated and comprehensive explanations of thyroid tumors, NET and tumor cells Written by experts from different laboratory and clinical areas, allowing us to relate laboratory data to clinical applications Provides economic data (including simulations and sensitivity analysis) as part of a modern approach to medical diagnosis (“choosing wisely medicine”)  This book highlights the increase in thyroid tumors and NET and demonstrates the growing importance of circulating markers in diagnosis as well as treatment and follow-up. Dramatic technical improvements have heightened the clinical impact of well-established, conventional biochemical markers. In addition, more recent genetic and molecular approaches have provided innovative molecular markers. In this context, effective communication between clinicians and laboratory physicians/scientists is essential in allowing all those involved to fully profit from these exciting advances.  In this comprehensive, up-to-date book, authors from different laboratory and clinical areas link laboratory and clinical topics. Analytical problems such as interferences, false-negative and false-positive results are discussed in depth, and flow-charts offer insights into identifying and avoiding them. Illustrated clinical cases detail the clinical role and limitations of different tumor markers. Lastly, it explores health technology assessment and economic issues.  This is a valuable resource for endocrinologists, oncologists, nuclear medicine physicians, scientists and technologists who want to keep abreast of the latest developments.  Author: Luca Giovanella completed his doctoral thesis at the University of Pavia (I) Medical School of in 1991. He subsequently obtained his postgraduate degrees in Nuclear Medicine (1995) and Endocrinology (2000) at the University of Milan (I) and was awarded an executive masters degree in Health Organisation and Human Resources Management (2000) by the Politecnico Universitario of Milan (I). He was a consultant at the University Hospital “Fondazione Macchi” of Varese (I) Department of Nuclear Medicine from 1993 to 2002, and he also chaired the Thyroid Unit and the Laboratory for Endocrinology from 1995 to 2002. Since 2003 he has been the Director of the Department of Nuclear Medicine-PET/CT and the Competence Centre for Thyroid Diseases at the Oncology Institute of Southern Switzerland (IOSI) in Bellinzona and Lugano. He also serves as a scientific advisor for the Department of Clinical Chemistry and Laboratory Medicine at Ente Ospedaliero Cantonale in Bellinzona. From 2008 to 2014 he has been a “Privat-Dozent” (PD) and since 2015 he is a ","PKR 16,718.00",LUCA GIOVANELLA,9783319625058,2019,MEDICAL > ALLERGY / IMMUNOLOGY / ENDOCRINOLOGY / GENETICS,,Hard Cover,English,249,images/books/9783319625058.jpg,http://paramountbooks.com.pk/loginindex.asp?title=ATLAS%2DOF%2DTHYROID%2DAND%2DNEUROENDOCRINE%2DTUMOR%2DMARKERS%2D%28hb%29%2D2018&isbn=9783319625058&opt=3&SubCat=06&Cat=06039
EXTRASKELETAL EFFECTS OF VITAMIN D: A CLINICAL GUIDE (hb) 2018,"Focuses exclusively on extraskeletal effects of vitamin D and its deficiency Discusses the role of vitamin D in autoimmune and infectious disease, cancer, diabetes, obesity, cardiovascular disease, neurological disease and cognitive function Ideal for clinical endocrinologists and primary care physicians  While the skeletal effects of vitamin D are well-documented, the role and importance of vitamin D outside of bone health has not been well-established. Vitamin D receptors are located in nearly every tissue of the body, and low levels of vitamin D are associated with a range of various diseases.  This book provides an in-depth examination of these extraskeletal effects of vitamin D and the associations between vitamin D deficiency and various disease states. Beginning with a review of the biochemistry and physiology of vitamin D, subsequent chapters investigate its relationship to autoimmune and infectious diseases, various forms of cancer, endocrine issues such as diabetes, obesity and reproductive function, cardiovascular disease and muscle weakness. Concluding chapters discuss the role of vitamin D in neurological disorders, including Alzheimer's Disease, and cognitive function.  Focusing on extraskeletal effects only across a range of conditions, Extraskeletal Effects of Vitamin D will be an important resource for clinical endocrinologists and primary care physicians.  Author: Emilia Pauline Liao, MD, Assistant Professor, Zucker School of Medicine at Hoftsra/Northwell, Lenox Hill Hospital, Division of Endocrinology, New York, NY, USA","PKR 16,718.00",EMILIA PAULINE LIAO,9783319737416,2019,MEDICAL > ALLERGY / IMMUNOLOGY / ENDOCRINOLOGY / GENETICS,1,Hard Cover,English,254,,http://paramountbooks.com.pk/loginindex.asp?title=EXTRASKELETAL%2DEFFECTS%2DOF%2DVITAMIN%2DD%3A%2DA%2DCLINICAL%2DGUIDE%2D%28hb%29%2D2018&isbn=9783319737416&opt=3&SubCat=06&Cat=06039
"PEDIATRIC ENDOCRINOLOGY, 3e (hb) 2018","A revised and updated edition of the classic 2013 textbook on pediatric endocrinology, including five new chapters and revamped interior design Discusses growth disorders, hypothalamic and pituitary disorders, adrenal disorders, thyroid disorders, mineral and bone disorders, reproductive disorders and contraception, metabolic disorders and endocrine emergencies Includes an updated and consistent chapter format that introduces the problem, reviews its clinical features, presents the diagnostic criteria, and discusses the management strategies with an eye to risks and benefits  A state-of-the-art and concise resource presenting the clinical management of pediatric endocrine diseases and disorders, this third edition of the highly regarded textbook covers the most common and challenging conditions seen by practicing endocrinologists and primary care physicians, including growth, hypothalamic, pituitary, adrenal, thyroid, calcium and bone, and reproductive disorders, as well as metabolic syndromes. This expanded third edition includes new topics such as conditions of overgrowth, low bone density and its management, endocrine issues related to sexual identity, mineralocorticoid disorders and endocrine hypertension, and endocrine emergencies. Some existing chapters are expanded to take into account recent advances in the field. Each chapter contains key points, an introductory discussion of the problem, a review of the clinical features that characterize it, the criteria needed to establish a diagnosis, and a comprehensive therapy section delineating the risks and benefits of the best therapeutic options available. New to this edition are concluding sections in each chapter containing relevant case material and multiple choice review questions.   Pediatric Endocrinology: A Practical Clinical Guide, Third Edition is a comprehensive resource for all clinicians concerned with the myriad endocrinologic disorders seen in children and adolescents.  Author: Sally Radovick, MD  Professor of Pediatrics  Chair, Department of Pediatrics  Senior Associate Dean for Clinical and Translational Research  Robert Wood Johnson Medical School  Physician-in-Chief  Bristol Myers-Squibb Children’s Hospital  Chancellor’s Scholar  New Brunswick, NJ, USA   Madhusmita Misra, MD, MPH  Fritz Bradley Talbot and Nathan Bill Talbot Professor of Pediatrics  Chief of the Division of Pediatric Endocrinology  Massachusetts General Hospital and Harvard Medical School  Boston, MA, USA","PKR 48,115.00",SALLY RADOVICK,9783319737812,2019,MEDICAL > ALLERGY / IMMUNOLOGY / ENDOCRINOLOGY / GENETICS,3,Hard Cover,English,882,images/books/9783319737812.jpg,http://paramountbooks.com.pk/loginindex.asp?title=PEDIATRIC%2DENDOCRINOLOGY%2C%2D3e%2D%28hb%29%2D2018&isbn=9783319737812&opt=3&SubCat=06&Cat=06039
METAL ALLERGY (hb) 2018,"This volume opens by providing a comprehensive overview of the use and regulation of metals in our society, metal properties, and available testing methodologies. Common and uncommon metal allergens and sources of exposure are then reviewed in depth, detailing allergic responses and paying special consideration to select patient populations. In the general population, the prevalence of metal allergy is high. Environmental sources of metal exposure include jewelry, clothing, electronic devices, coins, leather, diet, and occupational exposure. Metal allergy may result in allergic contact dermatitis and systemic contact dermatitis, as well as several less common manifestations. Further, metal allergy has been associated with device failure and/or dermatitis following implantation of medical devices and dental implants. As metals are ubiquitous, this book will be indispensable for a wide range of clinicians and investigators. This handy reference will meet the needs of all health professionals and investigators who are interested in metal allergy and its diagnosis and management.   About the Authors: Jennifer Chen is currently an assistant professor at Stanford University School of Medicine. She holds an MD from Johns Hopkins University and has completed a Howard Hughes Medical Institute fellowship at Stanford University School of Medicine. Dr. Chen has published 25 articles and authored 4 book chapters. Her areas of interest include allergic contact dermatitis and medical dermatology. She regularly delivers presentations at international meetings and has served as a consultant for the Women's Health and Contemporary Pediatrics magazines, Greatist, Reader's Digest, and the local news.   Jacob Thyssen has worked in clinical dermatology for more than 10 years and holds PhD and DmSci degrees from the University of Copenhagen in Denmark, where he is currently an associate professor. He has authored 250 articles, 12 book chapters and 2 textbooks (on patch testing and filaggrin proteins). Dr. Thyssen has received international awards for his research, including the LEO Pharma Research Foundation for best investigator aged below 45 years in the Nordic countries. His research has focused on atopic and contact dermatitis, allergies, and the skin barrier. He has been a research fellow in the USA, visiting Harvard Medical School and UCSF. Dr. Thyssen is a regular speaker at international meetings. He enjoys treating patients with dermatitis and metal allergies on a daily basis in the Gentofte Clinic in Copenhagen, Denmark. ","PKR 24,149.00",JENNIFER K. CHEN,9783319585024,2018,MEDICAL > ALLERGY / IMMUNOLOGY / ENDOCRINOLOGY / GENETICS,1,Hard Cover,English,578,images/books/9783319585024.jpg,http://paramountbooks.com.pk/loginindex.asp?title=METAL%2DALLERGY%2D%28hb%29%2D2018&isbn=9783319585024&opt=3&SubCat=06&Cat=06039
"ANCESTRAL DNA,HUMAN ORIGINS AND MIRGRATIONS (pb) 2018","Ancestral DNA, Human Origins, and Migrations describes the genesis of humans in Africa and the subsequent story of how our species migrated to every corner of the globe. Different phases of this journey are presented in an integrative format with information from a number of disciplines, including population genetics, evolution, anthropology, archaeology, climatology, linguistics, art, music, folklore and history. This unique approach weaves a story that has synergistic impact in the clarity and level of understanding that will appeal to those researching, studying, and interested in population genetics, evolutionary biology, human migrations, and the beginnings of our species.  Key Features Integrates research and information from the fields of genetics, evolution, anthropology, archaeology, climatology, linguistics, art, music, folklore and history, among others Presents the content in an entertaining and synergistic style to facilitate a deep understanding of human population genetics Informs on the origins and recent evolution of our species in an approachable manner  Author: Rene Herrera Ralph Garcia-Bertrand  Rene Herrera Dr. Rene Herrera holds degrees from The City College of the City University of New York (BS), New York University (MS) and Fordham University (Ph.D). He continued his studies in molecular biology/genetic engineering as a post-doctoral associate at The Rockefeller University and New York Medical College. His areas of research include mechanisms underlying control of gene expression at the pre-mRNA splicing level, human evolution and human forensic DNA fingerprinting. He is a frequent contributor to journals in the field of human genetics. Dr. Herrera has established collaborative efforts with several leading scientists worldwide attesting to his philosophy of expanding the reaches of his research. His commitment to creating a professional foundation for future scientific generations has led him to contribute to the education of numerous students as a mentor. A total of 15 Ph.D. and 41 M.S. students obtained their degree under his supervision and hundreds of undergraduate students have benefited from his guidance in conducting research. He is an author of over 200 full length articles. Affiliations and Expertise Visiting Scholar, Colorado College, Colorado Springs, Colorado, USA  Ralph Garcia-Bertrand Ralph Garcia-Bertrand is a Professor of Genetics in the Molecular Biology Department at Colorado College. He holds degrees from the University of Nevada (BS, MS), and The University of California, Riverside (PhD). He continued his studies as a post-doctoral fellow in the Department of Genetics, at the University of California, Berkeley. His research focuses on human population genetics and evolution. Dr. Garcia-Bertrand has won several teaching awards and has been the Director of undergraduate education programs funded by IBM, the Howard Hughes Medical Institute, and the Freeman Foundation. He has been a subcommittee member for various NIH research, educational, and underrepresented student programs for over 22 years. He is a lifetime member of the Society for the Advancement of Chicanos and Native Americans in Science, and the National Association of Biology Teachers. He teaches general and advanced genetics, human evolution, and a course on the ethics of genetics.  Affiliations and Expertise Verner Reed Professor of Genetics, Colorado College, Colorado Springs, Colorado, USA","PKR 16,338.00",RENE J. HERRERA,9780128041246,2018,MEDICAL > ALLERGY / IMMUNOLOGY / ENDOCRINOLOGY / GENETICS,1,Paperback,English,588,images/books/9780128041246.jpg,http://paramountbooks.com.pk/loginindex.asp?title=ANCESTRAL%2DDNA%2CHUMAN%2DORIGINS%2DAND%2DMIRGRATIONS%2D%28pb%29%2D2018&isbn=9780128041246&opt=3&SubCat=06&Cat=06039
"REVIEW OF MEDICAL MICROBIOLOGY & IMMUNOLOGY, 15e", ,"PKR 3,261.00",LEVINSON,9781260288445,2018,MEDICAL > ALLERGY / IMMUNOLOGY / ENDOCRINOLOGY / GENETICS,15,None,English,,images/books/9781260288445.jpg,http://paramountbooks.com.pk/loginindex.asp?title=REVIEW%2DOF%2DMEDICAL%2DMICROBIOLOGY%2D%26%2DIMMUNOLOGY%2C%2D15e&isbn=9781260288445&opt=3&SubCat=06&Cat=06039
ATLAS OF INHERITED METABOLIC DISEASES 3e (hb),,"PKR 28,525.00",WILLIAM L. NYHAN,9781138196599,2018,MEDICAL > ALLERGY / IMMUNOLOGY / ENDOCRINOLOGY / GENETICS,3,Hard Cover,English,888,images/books/9781138196599.jpg,http://paramountbooks.com.pk/loginindex.asp?title=ATLAS%2DOF%2DINHERITED%2DMETABOLIC%2DDISEASES%2D3e%2D%28hb%29&isbn=9781138196599&opt=3&SubCat=06&Cat=06039
THYROID NODULES: DIAGNOSIS AND MANAGEMENT (hb) 2018,"Unique and practical, focusing exclusively on diagnosis and management of thyroid nodules, utilizing the most current evidence Covers etiology and pathology, examination and imaging, fine needle aspiration, and treatment strategies including thyroxine therapy and minimally invasive surgery Written and edited by US and international experts in the treatment of thyroid disorders  Utilizing the most current evidence, this practical book is the first publication of its kind to focus exclusively on the clinical and laboratory evaluation and therapy of thyroid nodules, including advances in evaluation and controversies in management. Opening with chapters presenting the epidemiology, history, laboratory and clinical evaluation of thyroid nodules, the use of radioactive isotope ultrasound and CT scanning in diagnosis is then described. The interpretation of thyroid cytology following fine needle aspiration (FNA) biopsies and the use of molecular markers are discussed in detail, as is the controversial use of thyroxine therapy. Following a presentation of the common and minimally invasive surgical approaches to thyroid nodules, chapters on multinodal goiters, incidentalomas and thyroid nodules in children round out the presentation. Written and edited by leading US and international thyroidologists, Thyroid Nodules is a useful, state-of-the-art text for endocrinologists, surgeons, and primary care physicians.   Author: Hossein Gharib, MD, MACP, MACE Professor of Medicine Endocrinology, Diabetes, Metabolism, & Nutrition Mayo Clinic College of Medicine Rochester, MN, USA","PKR 20,433.00",HOSSEIN GHARIB,9783319594736,2018,MEDICAL > ALLERGY / IMMUNOLOGY / ENDOCRINOLOGY / GENETICS,1,Hard Cover,English,231,images/books/9783319594736.jpg,http://paramountbooks.com.pk/loginindex.asp?title=THYROID%2DNODULES%3A%2DDIAGNOSIS%2DAND%2DMANAGEMENT%2D%28hb%29%2D2018&isbn=9783319594736&opt=3&SubCat=06&Cat=06039
"A PRACTICAL GUIDE TO DIABETES MELLITUS, 8e (pb) 2018",,"PKR 4,603.00",NIHAL  M.D. THOMAS,9789352701650,2018,MEDICAL > ALLERGY / IMMUNOLOGY / ENDOCRINOLOGY / GENETICS,8,Paperback,English,698,images/books/9789352701650.jpg,http://paramountbooks.com.pk/loginindex.asp?title=A%2DPRACTICAL%2DGUIDE%2DTO%2DDIABETES%2DMELLITUS%2C%2D8e%2D%28pb%29%2D2018&isbn=9789352701650&opt=3&SubCat=06&Cat=06039
CLINICAL FOCUS SERIES: DIABETES MELLITUS (pb) 2018,,"PKR 2,065.00",ROMESH KHARDORI,9789352701803,2018,MEDICAL > ALLERGY / IMMUNOLOGY / ENDOCRINOLOGY / GENETICS,1,Paperback,English,180,images/books/9789352701803.jpg,http://paramountbooks.com.pk/loginindex.asp?title=CLINICAL%2DFOCUS%2DSERIES%3A%2DDIABETES%2DMELLITUS%2D%28pb%29%2D2018&isbn=9789352701803&opt=3&SubCat=06&Cat=06039
FUNDAMENTALS OF PAIN MEDICINE (pb) 2018,"Provides a quick intro to pain medicine for readers from a wide range of backgrounds  Highlights key contents that trainees are expected to master for the American Board of Anesthesiology's pain medicine subspecialty examination  Written by leading professionals in pain medicine and management  Characterized by clarity and straddling the line between scope and depth of information, this concise book provides physicians a comprehensive overview of pain medicine.  Chapters are written by some of the leading minds in pain medicine and feature case studies, key points and suggested readings.  Multidisciplinary approaches to the clinical and financial challenges of pain with the goal of improving patient quality of life are also discussed.  Additionally, the book is in is in tight alignment with the information that trainees are expected to master for the American Board of Anesthesiology’s pain medicine subspecialty certification, as outlined by the Joint Council on Anesthesiology Examinations; it covers the diagnosis of pain states, the management of pain, acute pain, radicular pain, neuropathic pain, chronic visceral pain, headaches, and special populations.  This book is a must-have for anyone new to pain medicine or studying for the subspecialty certification.  Author: Jianguo Cheng, MD, PhD  Professor of Anesthesiology  President-elect, American Academy of Pain Medicine  Director, Cleveland Clinic Multidisciplinary Pain Medicine Fellowship Program  Departments of Pain Management and Neurosciences  Cleveland Clinic Anesthesiology Institute and Lerner Research Institute  Cleveland, OH   Richard W. Rosenquist, MD  Chairman, Department Pain Management  Cleveland Clinic  Cleveland, OH","PKR 14,860.00",JIANGUO CHENG,9783319649207,2018,MEDICAL > ANAESTHESIA,,Paperback,English,359,images/books/9783319649207.jpg,http://paramountbooks.com.pk/loginindex.asp?title=FUNDAMENTALS%2DOF%2DPAIN%2DMEDICINE%2D%28pb%29%2D2018&isbn=9783319649207&opt=3&SubCat=06&Cat=06002
MORGAN AND MIKHAIL'S CLINICAL ANESTHESIOLOGY 6e,,"PKR 6,040.00",JOHN F. BUTTERWORTH,9781260288438,2018,MEDICAL > ANAESTHESIA,6,None,English,1393,images/books/9781260288438.jpg,http://paramountbooks.com.pk/loginindex.asp?title=MORGAN%2DAND%2DMIKHAIL%27S%2DCLINICAL%2DANESTHESIOLOGY%2D6e&isbn=9781260288438&opt=3&SubCat=06&Cat=06002
