PEARLS OF PATHOLOGY WITH MCQs & EASY QUESTIONS (pb) 2019,"Pearls of Pathology is an elucidation of the essence of pathology providing compulsory knowledge on the subject to all medical students. This is an illustrated treatise on the complex subject in most simpli¬fied manner, aimed to help medical and paramedical students. Multiple Choice Questions and Essay Questions based on clinical correlations and cases are also provided at the end of each chapter. Brief introduction to the topics is supplemented by lucid illustrations, photographs, diagrams and organized mini-sections for a comprehensive visual learning. This mini-textbook will get the students comfortably through the basics of Pathology across the board.  About the Author:  Dr. Anshoo Agarwal has worked as a Professor & Chairperson at Department of Pathology, RAK Medical and Health Sciences University. She received her Bachelor of Medicine & Bachelor of Surgery from King George's Medical College, Lucknow. Dr. Anshoo Agarwal received her MD in Pathology from LLRM Medical College/Ch. Charan Singh University. She has served at internationally reputed universities in Nepal and Malaysia and remained a Discipline Coordinator in University Technology MARA, Malaysia. She is associated as a member with many scientifi¬c associations like International Academy Pathology, Indian Society of Hematology & Transfusion Medicine, Emirates Medical Association Pathology Society, etc.  Dr. Manal Mahmoud Sami received her MBChB degree and then her MSc and MD/ PhD in Pathology from Faculty of Medicine, Suez Canal University, Egypt. She has over 20 years’ experience in teaching Pathology for undergraduate and postgraduate students at Suez Canal University and Ras Al Khaimah Medical and Health Sciences University. Dr. Manal has authored many researches in the fi¬elds of Experimental and Molecular Pathology, Histopathology, as well as Medical Education. Currently, she works as Professor of Pathology and Dean of Students Affairs at Ras Al Khaimah Medical and Health Sciences University and Associate Professor of Pathology at Faculty of Medicine, Suez Canal University. She is a member of the Egyptian Society of Pathology and the Emirates Medical Society-Pathology. ",PKR 445.00,ANSHOO AGARWAL,9789696373858,2019,MEDICAL > PATHOLOGY,1,Paperback,English,152,images/books/9789696373858.jpg,http://paramountbooks.com.pk/loginindex.asp?title=PEARLS%2DOF%2DPATHOLOGY%2DWITH%2DMCQs%2D%26%2DEASY%2DQUESTIONS%2D%28pb%29%2D2019&isbn=9789696373858&opt=3&SubCat=06&Cat=06029
DIAGNOSIS OF BLOOD AND BONE MARROW DISORDERS (hb) 2018,"This book focuses on hematopoietic and lymphoid neoplasms that initially present as peripheral blood abnormalities, with either cytopenias or elevated peripheral blood counts, as well as non-neoplastic conditions that may raise concern for a hematologic malignancy. The scope of the book includes myelodysplastic syndromes (MDS), myeloproliferative neoplasms (MPN), mixed myelodysplastic/myeloproliferative neoplasms (MDS/MPN), as well as lymphomas and lymphoid leukemias that typically present initially with peripheral blood abnormalities.  Within each category, a comprehensive list of differential diagnoses is discussed. For each disease entity, the reader is updated with new molecular genetic data, biomarkers, and recent applications of immunophenotyping, and how to incorporate the new information in disease diagnosis and classifications is illustrated, including the use of diagnostic algorithms where appropriate. The book employs the revised WHO Classification of Hematopoietic Neoplasms for all disease entities.   Diagnosis of Blood and Bone Marrow Disorders will serve as a very useful resource for pathologists, pathologists in training, hematologists and medical technologists who are involved in the clinical work-up of patients with bone marrow and blood neoplasms.  It will provide a practical and concise yet comprehensive review.  Authors: Sa A. Wang, MDAssociate Professor of Pathology Department of Hematopathology The University of Texas MD Anderson Cancer Center1515 Holcombe Blvd Houston, TX 770307137922603, swang5@mdanderson.org Robert P. Hasserjian, MD Associate Professor of Pathology Department of Pathology Massachusetts General Hospital 55 Fruit Street 2 02114 6177241445, RHASSERJIAN@mgh.harvard.edu","PKR 20,433.00",SA A. WANG,9783319202785,2018,MEDICAL > PATHOLOGY,1,Hard Cover,English,412,images/books/9783319202785.jpg,http://paramountbooks.com.pk/loginindex.asp?title=DIAGNOSIS%2DOF%2DBLOOD%2DAND%2DBONE%2DMARROW%2DDISORDERS%2D%28hb%29%2D2018&isbn=9783319202785&opt=3&SubCat=06&Cat=06029
ATLAS OF LUNG PATHOLOGY (hb) 2018,"Atlas of Lung Pathology offers a comprehensive survey of common and uncommon conditions likely to be encountered in a wide range of practices.  It begins with a review of normal macroscopic and microscopic lung anatomy followed by practical tips on how to handle the most common specimens received in pathology practice.  Non-neoplastic conditions are segregated into logical categories intended to make them easily accessible to quickly offer solutions for diagnostic problems encountered in daily practice.  Each illustration was carefully chosen using images drawn from experienced contributors familiar with the challenges of diagnostic pulmonary pathology.?  Authors: Chen Zhang, MD, PhDDepartment of Pathology and Laboratory MedicineIndiana University School of Medicine 350 West 11th Street, Room 4084Indianapolis, IN 46202, USA Jeffrey L. Myers, MDDepartment of PathologyMichigan Medicine1301 Catherine Street, SPC 5602Ann Arbor, MI 48109, USA","PKR 31,579.00",CHEN ZHANG,9781493986873,2018,MEDICAL > PATHOLOGY,1,Hard Cover,English,284,images/books/9781493986873.jpg,http://paramountbooks.com.pk/loginindex.asp?title=ATLAS%2DOF%2DLUNG%2DPATHOLOGY%2D%28hb%29%2D2018&isbn=9781493986873&opt=3&SubCat=06&Cat=06029
PRECISION MOLECULAR PATHOLOGY OF BLADDER CANCER (hb) 2018,,"PKR 16,718.00",DONNA E. HANSEL,9783319647678,2018,MEDICAL > PATHOLOGY,,Hard Cover,English,243,images/books/9783319647678.jpg,http://paramountbooks.com.pk/loginindex.asp?title=PRECISION%2DMOLECULAR%2DPATHOLOGY%2DOF%2DBLADDER%2DCANCER%2D%28hb%29%2D2018&isbn=9783319647678&opt=3&SubCat=06&Cat=06029
MOLECULAR PATHOLOGY AN DTHE DYNAMICS OF DISEASE (pb) 2018,"Molecular Pathology and the Dynamics of Disease bridges the basic science of, and primary clinical literature on, human disease. Topics covered include several major disease areas, such as inflammation and host response, vascular disease, obesity, weight regulation and appetite, cancer biology, drug development, and gene- and cell-based therapeutics that are all presented in a way that emphasizes the interplay between clinical care and investigation. As new technologies and techniques are constantly changing and laboratory scientists plays a critical role in validating data used by clinicians in diagnosing patients, this book provides a timely guide that includes a clinical, research and theory perspective.  Key Features Assimilates theoretical knowledge with practical lab work Provides a needed clinical perspective, along with research and theory Highlights the impact of basic science on the practice of medicine  Author: Maika Mitchell The lead scientist and principle author in numerous studies involving tumor immunology, Dr. Mitchell has current teaching experience in anatomy and physiology, including recognition for contributions to research development, revenue-focused product development and management of high-tech operations. She is a contributor to the NCBI SNP database for pediatirc and urological cancers.  Dr. Mitchell has been a research scientist for well over 17 years in the biomedical field, most recently as Senior Director of Research & Development in Greater New York conducting flow cytometry and molecular-based assays in conjunction with bioinformatics.  Affiliations and Expertise ASCP, NSBE, AACC, CAP, NYSDOH, Lean Six Sigma Master Black Belt, MSKCC, CLC bio, The Science Advisory Board, BioConference Live!, Touch Oncology, PRIMR, and Lean In Community","PKR 16,338.00",MAIKA G. MITCHELL,9780128146101,2018,MEDICAL > PATHOLOGY,1,Paperback,English,178,images/books/9780128146101.jpg,http://paramountbooks.com.pk/loginindex.asp?title=MOLECULAR%2DPATHOLOGY%2DAN%2DDTHE%2DDYNAMICS%2DOF%2DDISEASE%2D%28pb%29%2D2018&isbn=9780128146101&opt=3&SubCat=06&Cat=06029
CELL THERAPY: CURRENT STATUS AND FUTURE DIRECTIONS (pb) 2018,"This volume provides a comprehensive, state-of-the art review of the field of cell therapy.  The volume begins with an overview of the breadth of the field and then turns to overviews of imaging technologies that can aid in both safety and efficacy evaluations. The book then turns to numerous contributions detailing the rapidly growing field of stem cell therapies. These sections cover our understanding of the natural roles of stem cells in biology and human disease and then touches on several of the more prominent areas where stem cells are moving rapidly into clinical evaluation including neurodegenerative diseases, muscular dystrophy, cardiac repair, and diabetes. The volume concludes with contributions from experts in oncology, ophthalmology, stem cells, 3-D printing, and biomaterials where the convergence of expertise is leading to unprecedented insights into how to minutely control the in vivo fate and function of transplanted and/or endogeneously mobilized cells.  Finally, the book provides insights into the pivotal relationship between academic and industrial partnerships.  This volume is designed to touch on the major areas where the field will make its greatest and most immediate clinical impacts.  This text will provide a useful resource for physicians and researchers interested in the rapidly changing filed of cell therapy.  Author:  Dwaine Emerich  Gorka Orive  Dwaine F. Emerich, PhD VP R&D NsGene, inc. 225 Chapman Street Providence Rhode Island 02905 Phone: 401-429-9249  Gorka Orive, PhD Associate Professor of Pharmacy & Pharmaceutical Technology Networking Biomedical Research Center on Bioengineering, Biomaterials and Nanomedicine, CIBER-BBN Faculty of Pharmacy (UPV /EHU) Paseo de la Universidad 7 01006 Vitoria-Gastez (Spain) Phone: +34 663027696 gorka.orive@ehu.es ","PKR 20,433.00",DWAINE EMERICH,9783319571522,2018,MEDICAL > PATHOLOGY,1,Hard Cover,English,328,images/books/9783319571522.jpg,http://paramountbooks.com.pk/loginindex.asp?title=CELL%2DTHERAPY%3A%2DCURRENT%2DSTATUS%2DAND%2DFUTURE%2DDIRECTIONS%2D%28pb%29%2D2018&isbn=9783319571522&opt=3&SubCat=06&Cat=06029
USMLE® STEP 1 LECTURE NOTES 2018: PHARMACOLOGY (pb) 2018,,"PKR 9,806.00",.,9781506239576,2018,MEDICAL > PHARMACOLOGY,,Paperback,English,321,images/books/9781506239576.jpg,http://paramountbooks.com.pk/loginindex.asp?title=USMLE%AE%2DSTEP%2D1%2DLECTURE%2DNOTES%2D2018%3A%2DPHARMACOLOGY%2D%28pb%29%2D2018&isbn=9781506239576&opt=3&SubCat=06&Cat=06030
NAUMAN’S CLASSIFICATION OF DRUGS (pb) 2018,,PKR 295.00,MUHAMMAD NAUMAN SHAD,9789696375005,2018,MEDICAL > PHARMACOLOGY,1,Paperback,English,128,images/books/9789696375005.jpg,http://paramountbooks.com.pk/loginindex.asp?title=NAUMAN%92S%2DCLASSIFICATION%2DOF%2DDRUGS%2D%28pb%29%2D2018&isbn=9789696375005&opt=3&SubCat=06&Cat=06030
KATZUNG & TREVOR'S PHARMACOLOGY EXAMINATION AND BOARD REVIEW 12e (pb) 2019,,"PKR 3,261.00",BERTRAM G KATZUNG,9781260288483,2018,MEDICAL > PHARMACOLOGY,12,Paperback,English,585,images/books/9781260288483.jpg,http://paramountbooks.com.pk/loginindex.asp?title=KATZUNG%2D%26%2DTREVOR%27S%2DPHARMACOLOGY%2DEXAMINATION%2DAND%2DBOARD%2DREVIEW%2D12e%2D%28pb%29%2D2019&isbn=9781260288483&opt=3&SubCat=06&Cat=06030
"PHARMACOLOGY AND PHARMACOTHERAPEUTICS, 25e (pb) 2017",,"PKR 2,757.00",R.S. SATOSKAR,9788131248867,2018,MEDICAL > PHARMACOLOGY,25,Paperback,English,1200,images/books/9788131248867.jpg,http://paramountbooks.com.pk/loginindex.asp?title=PHARMACOLOGY%2DAND%2DPHARMACOTHERAPEUTICS%2C%2D25e%2D%28pb%29%2D2017&isbn=9788131248867&opt=3&SubCat=06&Cat=06030
A TEXTBOOK OF PHARMACOLOGY 3e (pb) 2018,,PKR 542.00,PARADEEP KUMAR,9789374734551,2018,MEDICAL > PHARMACOLOGY,3,Paperback,English,291,images/books/9789374734551.jpg,http://paramountbooks.com.pk/loginindex.asp?title=A%2DTEXTBOOK%2DOF%2DPHARMACOLOGY%2D3e%2D%28pb%29%2D2018&isbn=9789374734551&opt=3&SubCat=06&Cat=06030
"PRACTICAL PHARMACOLOGY, 5e (pb) 2017",,PKR 519.00,PRAMILA V. YADAV,9789386261809,2018,MEDICAL > PHARMACOLOGY,5,Paperback,English,,images/books/9789386261809.jpg,http://paramountbooks.com.pk/loginindex.asp?title=PRACTICAL%2DPHARMACOLOGY%2C%2D5e%2D%28pb%29%2D2017&isbn=9789386261809&opt=3&SubCat=06&Cat=06030
EXPERIMENTAL PHARMACOLOGY AND TOXICOLOGY (pb) 2014,,PKR 219.00,VRUSHABENDRA SWAMY,9788121942492,2018,MEDICAL > PHARMACOLOGY,1,Paperback,English,119,images/books/9788121942492.jpg,http://paramountbooks.com.pk/loginindex.asp?title=EXPERIMENTAL%2DPHARMACOLOGY%2DAND%2DTOXICOLOGY%2D%28pb%29%2D2014&isbn=9788121942492&opt=3&SubCat=06&Cat=06030
CLINICAL PHARMACOLOGY (IE) 12e (pb) 2018,,"PKR 4,199.00",BROWN,9780702073298,2018,MEDICAL > PHARMACOLOGY,12,Paperback,English,720,images/books/9780702073298.jpg,http://paramountbooks.com.pk/loginindex.asp?title=CLINICAL%2DPHARMACOLOGY%2D%28IE%29%2D12e%2D%28pb%29%2D2018&isbn=9780702073298&opt=3&SubCat=06&Cat=06030
GUIDELINES FOR ANTIMICROBIAL USAGE 2017-2018 (pb)2017,"Guidelines for Antimicrobial Usage 2017-2018 provides concise guidance on antimicrobial regimens for commonly encountered diseases in the hospital setting. Guidelines developed through a rigorous, multidiscipline process involving the departments of infectious disease, clinical pathology, pediatrics, and pharmacy at the Cleveland Clinic.  ","PKR 1,953.00",CLEVELAD CLINIC,9781943236145,2018,MEDICAL > PHARMACOLOGY,1,Paperback,English,85,images/books/9781943236145.jpg,http://paramountbooks.com.pk/loginindex.asp?title=GUIDELINES%2DFOR%2DANTIMICROBIAL%2DUSAGE%2D2017%2D2018%2D%28pb%292017&isbn=9781943236145&opt=3&SubCat=06&Cat=06030
"BASIC AND CLINICAL PHARMACOLOGY, 14e (pb) INDIAN ED) 2018",,"PKR 4,659.00",BERTRAM G KATZUNG,9789353160692,2018,MEDICAL > PHARMACOLOGY,14,Paperback,English,,images/books/9789353160692.jpg,http://paramountbooks.com.pk/loginindex.asp?title=BASIC%2DAND%2DCLINICAL%2DPHARMACOLOGY%2C%2D14e%2D%28pb%29%2DINDIAN%2DED%29%2D2018&isbn=9789353160692&opt=3&SubCat=06&Cat=06030
BNF 75 MARCH-SEPTEMBER 2018 (pb)2018,,"PKR 11,961.00",.,9780857113313,2018,MEDICAL > PHARMACY & DRUG,75,Paperback,English,1600,images/books/9780857113313.jpg,http://paramountbooks.com.pk/loginindex.asp?title=BNF%2D75%2DMARCH%2DSEPTEMBER%2D2018%2D%28pb%292018&isbn=9780857113313&opt=3&SubCat=06&Cat=06031
"MODIFIED-RELEASE DRUG DELIVERY TECHNOLOGY, 2e (hb) 2008","This two volume Second Edition describes the anatomical, physiological, pharmaceutical, and technological aspects of delivery routes, found in areas like:  Oral Ocular Dermal and transdermal Vaginal Colonic Oral mucosal Nasal Pulmonary Providing insight and critical assessment of the many available and emerging modified release drug delivery systems for their current and future value, topics include:  Intellectual property rights and regulatory issues and challenges osmotic systems and Qtrol. Qdis. Matrix Systems thiolated polymers for CR, Oradur. IDD technology, and chronotherapy technology Oral-lyn™ (RapidMist™ Technology) Dentipatch drug delivery system ORAVESCENT™: a novel technology for the transmucosal delivery of drugs Egalet and COLAL technologies  Author: Michael J. Rathbone, Jonathan Hadgraft, Michael S. Roberts, Majella E. Lane  MICHAEL J. RATHBONE is Director, Research and Development, and General Manager of InterAg, a Division of DEC International NZ Limited, Hamilton, New Zealand. Dr. Rathbone received his Ph.D. in Pharmaceutical Science from the University of Aston, Birmingham, England, and has innovated many novel modified-release drug delivery systems, several of which have been commercialized. Dr. Rathbone has written over 35 peer-reviewed articles, has licensed five US patents and has edited or co-edited three books and numerous special issues of journals.  JONATHAN HADGRAFT is Professor of Biophysical Chemistry, University of London, United Kingdom. Dr. Hadgraft received his D.Phil. in Chemistry and his D.Sc. in Medicine from the University of Oxford, United Kingdom. His major research interests are in the application of physical chemistry to drug delivery, with special reference to the skin. He has been elected to Fellowships of the Royal Society of Chemistry and the American Association of Pharmaceutical Scientists, and has contributed to over 500 publications. He has contributed numerous book chapters and has co-edited several books. He serves on a number of editorial boards of pharmaceutical science journals.  MICHAEL S. ROBERTS is Professor, School of Medicine, University of Queensland, Brisbane, Australia; Senior Principal Research Fellow, National Health and Research Council; Director Therapeutics Research Unit, Princess Alexandra Hospital, Queensland Australia; Adjunct Professor, University of Canberra, Australia; and Visiting Professor, University of Lyon, France. Dr. Roberts received his Ph.D. and D.Sc. from the University of Sydney, Australia, and his M.B.A. from the University of Queensland. Dr. Roberts has also written over 280 peer-reviewed articles, 36 chapters, and has edited or co-edited five books.  MAJELLA E. LANE is a lecturer in Pharmaceutics in the School of Pharmacy, University of London, United Kingdom. She received her Ph.D. from Trinity College, Dublin, Ireland, and spent a sabbatical period at the University of Michigan, Ann Arbor, where she holds a Visiting Associate Scientist appointment. Her current research interests include development of vaccine dosage forms, formulation of peptides, transdermal drug delivery and mucosal drug delivery, and modeling of absorption processes across epithelial barriers.","PKR 27,041.00",MICHAEL J. RATHBONE,9781420044355,2018,MEDICAL > PHARMACY & DRUG,2,Hard Cover,English,528,images/books/9781420044355.jpg,http://paramountbooks.com.pk/loginindex.asp?title=MODIFIED%2DRELEASE%2DDRUG%2DDELIVERY%2DTECHNOLOGY%2C%2D2e%2D%28hb%29%2D2008&isbn=9781420044355&opt=3&SubCat=06&Cat=06031
"ANSEL'S PHARMACEUTICAL DOSAGE FORMS AND DRUG DELIVERY SYSTEMS, 11e (pb) 2018",,"PKR 3,346.00",LOYD V. ALLEN,9789387506725,2018,MEDICAL > PHARMACY & DRUG,11,Paperback,English,,images/books/9789387506725.jpg,http://paramountbooks.com.pk/loginindex.asp?title=ANSEL%27S%2DPHARMACEUTICAL%2DDOSAGE%2DFORMS%2DAND%2DDRUG%2DDELIVERY%2DSYSTEMS%2C%2D11e%2D%28pb%29%2D2018&isbn=9789387506725&opt=3&SubCat=06&Cat=06031
"WINTER'S BASIC CLINICAL PHARMACOKINETICS, 6e (pb) 2018",,"PKR 2,192.00",PAUL M. BERINGER,9789387506671,2018,MEDICAL > PHARMACY & DRUG,6,Paperback,English,,images/books/9789387506671.jpg,http://paramountbooks.com.pk/loginindex.asp?title=WINTER%27S%2DBASIC%2DCLINICAL%2DPHARMACOKINETICS%2C%2D6e%2D%28pb%29%2D2018&isbn=9789387506671&opt=3&SubCat=06&Cat=06031
"NURSING 2019 DRUG HANDBOOK, 39e (pb) 2018",,"PKR 7,354.00",LIPPINCOTT,9781496353597,2018,MEDICAL > PHARMACY & DRUG,39,Paperback,English,1856,,http://paramountbooks.com.pk/loginindex.asp?title=NURSING%2D2019%2DDRUG%2DHANDBOOK%2C%2D39e%2D%28pb%29%2D2018&isbn=9781496353597&opt=3&SubCat=06&Cat=06031
"NURSING 2019 DRUG HANDBOOK, 39e (pb) 2018",,"PKR 7,354.00",LIPPINCOTT,9781496384072,2018,MEDICAL > PHARMACY & DRUG,39,Paperback,English,1856,images/books/9781496384072.jpg,http://paramountbooks.com.pk/loginindex.asp?title=NURSING%2D2019%2DDRUG%2DHANDBOOK%2C%2D39e%2D%28pb%29%2D2018&isbn=9781496384072&opt=3&SubCat=06&Cat=06031
METHODS IN DRUG EVALUATION (pb) 2018,,PKR 911.00,TIWARI PRAFULLA CHANDRA,9789352701469,2018,MEDICAL > PHARMACY & DRUG,1,Paperback,English,152,images/books/9789352701469.jpg,http://paramountbooks.com.pk/loginindex.asp?title=METHODS%2DIN%2DDRUG%2DEVALUATION%2D%28pb%29%2D2018&isbn=9789352701469&opt=3&SubCat=06&Cat=06031
"FUNDAMENTALS OF NUCLEAR PHARMACY, 7e (pb) 2018",,"PKR 16,718.00",GOPAL SAHA,9783319575797,2018,MEDICAL > PHARMACY & DRUG,7,Paperback,English,428,images/books/9783319575797.jpg,http://paramountbooks.com.pk/loginindex.asp?title=FUNDAMENTALS%2DOF%2DNUCLEAR%2DPHARMACY%2C%2D7e%2D%28pb%29%2D2018&isbn=9783319575797&opt=3&SubCat=06&Cat=06031
PHARMA GUIDE 2018 25e (pb),,"PKR 1,500.00",. . .,999937,2018,MEDICAL > PHARMACY & DRUG,,Paperback,English,,images/books/999937.jpg,http://paramountbooks.com.pk/loginindex.asp?title=PHARMA%2DGUIDE%2D2018%2D25e%2D%28pb%29&isbn=999937&opt=3&SubCat=06&Cat=06031
PSYCHIATRIC DRUG HANDBOOK (pb) 2018,"This book is intended to provide coverage of all important aspects of drugs used in psychiatric disorders, in an easy, concise yet comprehensive style. It will save time and certainly be very useful to the busy practitioners as well as students. Information in bullets, tables and clinical pearls at the end of chapters emphasizes important points, which can be memorized easily. Moreover certain chapters like Antidepressants, Psychiatric Drug Therapy in Special Conditions and Drug-Drug Interactions have been delayed. Key Features • Compact, informative and user-friendly guidebook, regarding pharmacotherapy of all important psychiatric disorders dealt in clinical practice   • Information in bullets, tables and clinical pearls at the end of chapters emphasizes important points.  Authors: 	 Lopamudra (Dhar) Chowdhury	MD (Pharmacology) Om Prakash Singh	MD (Psychiatry)",PKR 681.00,LOPAMUDRA CHOWDHURY,9789352703159,2018,MEDICAL > PHARMACY & DRUG,1,Paperback,English,144,images/books/9789352703159.jpg,http://paramountbooks.com.pk/loginindex.asp?title=PSYCHIATRIC%2DDRUG%2DHANDBOOK%2D%28pb%29%2D2018&isbn=9789352703159&opt=3&SubCat=06&Cat=06031
MEDICATION THERAPY MANAGEMENT,,"PKR 5,214.00",WHALEN,9781260288544,2018,MEDICAL > PHYSIOTHERAPY / REHABILITATION,1,Paperback,English,,,http://paramountbooks.com.pk/loginindex.asp?title=MEDICATION%2DTHERAPY%2DMANAGEMENT&isbn=9781260288544&opt=3&SubCat=06&Cat=06032
DANIELS AND WORTHINGHAM'S MUSCLE TESTING: TECHNIQUES OF MANUAL EXAMINATION AND PERFORMANCE TESING (FIRST SOUTH ASIA EDITION) 2018,"A practical handbook on evaluating muscular strength and function, Daniels and Worthingham's Muscle Testing: Techniques of Manual Examination and Performance Testing, This Edition makes it easy to understand and master procedures in manual muscle testing and performance testing. Clear, illustrated instructions provide a guide to patient positioning, direction of motion, and direction of resistance. In addition to muscle testing of normal individuals and others with weakness or paralysis, this edition includes new coverage of alternative strength tests and performance tests for older adults and others with functional decline (such as the inactive and obese). Written by educators Helen J. Hislop, Dale Avers, and Marybeth Brown, this classic physical therapy reference now features an Evolve companion website with video clips demonstrating key muscle testing techniques.  Key Features:-   Drawings and arrows along with clear written directions make it easy to understand and perform muscle testing procedures, allowing you to assess deficits in strength, balance, and range of motion. More than 600 illustrations clearly show testing sequences, muscle anatomy, and muscle innervation. Video clips of over 100 muscle tests on the Evolve companion website demonstrate the art and technique of muscle testing in a clinical setting. Details of muscle anatomy and innervation help in linking muscle topography with function. Helpful Hints and Substitutions boxes provide additional tips and highlight muscle substitutions that may occur during a test to ensure greater accuracy in testing. A constant reference number clearly identifies each muscle in the body, indexed in the Alphabetical List of Muscles by Region as well as in the Ready Reference Anatomy Manual on Evolve, to speed cross-referencing and help you quickly identify any muscle.  Author : Marybeth Brown, Dale Avers","PKR 4,373.00",DALE AVERS,9788131256374,2018,MEDICAL > PHYSIOTHERAPY / REHABILITATION,1,Paperback,English,,images/books/9788131256374.jpg,http://paramountbooks.com.pk/loginindex.asp?title=DANIELS%2DAND%2DWORTHINGHAM%27S%2DMUSCLE%2DTESTING%3A%2DTECHNIQUES%2DOF%2DMANUAL%2DEXAMINATION%2DAND%2DPERFORMANCE%2DTESING%2D%28FIRST%2DSOUTH%2DASIA%2DEDITION%29%2D2018&isbn=9788131256374&opt=3&SubCat=06&Cat=06032
"TEXTBOOK OF ELECTROTHERAPY, 3e (pb) 2018",,"PKR 1,442.00",JAGMOHAN SINGH,9789352702107,2018,MEDICAL > PHYSIOTHERAPY / REHABILITATION,3,Paperback,English,350,images/books/9789352702107.jpg,http://paramountbooks.com.pk/loginindex.asp?title=TEXTBOOK%2DOF%2DELECTROTHERAPY%2C%2D3e%2D%28pb%29%2D2018&isbn=9789352702107&opt=3&SubCat=06&Cat=06032
TEXTBOOK OF KINESIOLOGY (pb) 2018,,"PKR 1,142.00",BINDAL VD,9789352704521,2018,MEDICAL > PHYSIOTHERAPY / REHABILITATION,1,Paperback,English,238,images/books/9789352704521.jpg,http://paramountbooks.com.pk/loginindex.asp?title=TEXTBOOK%2DOF%2DKINESIOLOGY%2D%28pb%29%2D2018&isbn=9789352704521&opt=3&SubCat=06&Cat=06032
TEXTBOOK OF PREVENTIVE PRACTICE AND COMMUNITY PHYSIOTHERAPY VOLUME-1 (pb) 2018,,"PKR 1,604.00",BHARATI VIJAY BELLARE,9789352703258,2018,MEDICAL > PHYSIOTHERAPY / REHABILITATION,1,Paperback,English,568,images/books/9789352703258.jpg,http://paramountbooks.com.pk/loginindex.asp?title=TEXTBOOK%2DOF%2DPREVENTIVE%2DPRACTICE%2DAND%2DCOMMUNITY%2DPHYSIOTHERAPY%2DVOLUME%2D1%2D%28pb%29%2D2018&isbn=9789352703258&opt=3&SubCat=06&Cat=06032
TEXTBOOK OF PREVENTIVE PRACTICE AND COMMUNITY PHYSIOTHERAPY VOLUME-2 (pb) 2018,,"PKR 1,604.00",BHARATI VIJAY BELLARE,9789352704033,2018,MEDICAL > PHYSIOTHERAPY / REHABILITATION,,Paperback,English,304,images/books/9789352704033.jpg,http://paramountbooks.com.pk/loginindex.asp?title=TEXTBOOK%2DOF%2DPREVENTIVE%2DPRACTICE%2DAND%2DCOMMUNITY%2DPHYSIOTHERAPY%2DVOLUME%2D2%2D%28pb%29%2D2018&isbn=9789352704033&opt=3&SubCat=06&Cat=06032
